{
    "$schema": "https://json-schema.org/draft/2020-12/schema",
    "type": "object",
    "properties": {
        "id": {
            "type": "number"
        },
        "uuid": {
            "type": [
                "string",
                "null"
            ]
        },
        "label": {
            "type": "string"
        },
        "desc": {
            "type": "string"
        },
        "properties_template": {
            "$ref": "chemotion://generic/properties/draft-01"
        },
        "properties_release": {
            "$ref": "chemotion://generic/properties/draft-01"
        },
        "is_active": {
            "type": "boolean"
        },
        "version": {
            "type": [
                "null",
                "string"
            ]
        },
        "place": {
            "type": "number"
        },
        "released_at": {
            "type": "string"
        },
        "identifier": {
            "type": [
                "string",
                "null"
            ]
        },
        "sync_time": {},
        "created_by": {
            "type": "number"
        },
        "updated_by": {
            "type": "number"
        },
        "created_at": {
            "type": "string"
        },
        "updated_at": {
            "type": "string"
        },
        "metadata": {
            "type": [
                "object",
                "null"
            ]
        },
        "name": {
            "type": "string"
        },
        "icon_name": {
            "type": "string"
        },
        "klass_prefix": {
            "type": "string"
        },
        "is_generic": {
            "type": "boolean"
        }
    },
    "additionalProperties": false,
    "required": [
        "id",
        "uuid",
        "label",
        "desc",
        "properties_template",
        "properties_release",
        "is_active",
        "version",
        "place",
        "released_at",
        "identifier",
        "sync_time",
        "created_at",
        "updated_at",
        "name",
        "icon_name",
        "is_generic",
        "klass_prefix"
    ],
    "$id": "chemotion://generic/element/draft-01",
    "title": "Schema for generic element"
}